{
  "proposal_id": "prop_1",
  "gameweek": 3,
  "plan_id": "plan_1",
  "decision_record_path": "reports/gameweeks/3/decision-record.json",
  "observed_at": "2026-07-21T12:00:00Z",
  "available_at": "2026-07-21T12:00:00Z",
  "provenance": {
    "source_ids": [
      "fpl-official-endpoints"
    ],
    "transformation_version": "0.1.0",
    "ruleset_id": "2026-27-v0.1"
  }
}
